Sentiment,Strength,Conditions,Comment,Age,Gender,Postal CodeFavour,Somewhat in Favour,F,People can already gamble/bet in Toronto - I don't think it would necessarily increase or worsen issue of problem gambling Could bring in new revenue/new business/more tourism to the city - basically I think the potential benefits outweigh the potential negatives ,25-34,Female,M4L
Favour,Somewhat in Favour,F,In favour because of revenue potential and job creation Not strongly in favour because there's always the downside for encouraging gambling addiction ,,,
Favour,Strongly in Favour,F,revenue tourism fun,35-44,Male,m4m
Favour,Strongly in Favour,F,Tourism Jobs Entertainment,45-54,Male,M4X
Favour,Somewhat in Favour,F,Increase in travel and tourism for Toronto. Employment opportunities . Must be strict rules and regulations in regards to gambling and alcohol .,35-44,Female,M4n
Favour,Strongly in Favour,F,Employment Entertainment Trade shows,45-54,Male,M1N
Favour,Strongly in Favour,F,it can create more jobs for people  ,,,
Favour,Strongly in Favour,F,Raise budget Tourist attraction Expand cultural experience in gta,15-24,Male,M6J
Favour,Strongly in Favour,F,Increase in jobs for Toronto residents Encourages tourism Encourages people spend money in Toronto instead of Niagara or Orillia,25-34,Male,M1W
Favour,Strongly in Favour,F,more jobs more income more tourist,,,
Favour,Strongly in Favour,F,New Revenue stream for infrastructure. Casino has improved Niagara Falls infrastructure ,,,
Favour,Strongly in Favour,F,"A casino will generate much needed income into the city of Toronto I myself live right downtown and would love to have a casino plus different restaurants, shows and retailers to choose from The amount of jobs a casino could create would be phenomenal",25-34,Female,M5v
Favour,Strongly in Favour,F,More well-paying jobs Tourism A great attraction,25-34,Male,M3H
Favour,Somewhat in Favour,F,greater revenue to the city greater improvement to the GDP Potential increase in problem gambling,15-24,Male,M2N
Favour,Strongly in Favour,F,The government will increase the money The ttc can borrow the money from the governement ,,,
Favour,Strongly in Favour,F,Creates new job Brings additional funds into Toronto New entertainment,45-54,Female,M1E
Favour,Somewhat in Favour,F,More jobs More revenue to the city Increased tourism,15-24,Male,M2N
Favour,Strongly in Favour,F,bring jobs more entainment in the city bring in tourist; and given tourist another reason to love toronto,25-34,Female,m9w
Favour,Strongly in Favour,F,Revenue Stream Improve City Infrastructure ,45-54,Male,m6r
Favour,Strongly in Favour,F,This would put Toronto as a first class city Good for tourism Would bring in a lot of money to the city,45-54,Female,L1g
Favour,Strongly in Favour,F,Improve Tourism improve cashflow for the city I will no longer have to play poker online ... I would prefer live and give back some dollars to my community!,35-44,Male,M5C
Favour,Strongly in Favour,F,More tourism to Toronto Job Creation More entertainment options,,,
Favour,Strongly in Favour,F,jobs city income tourism,55-64,Female,M8V
Favour,Strongly in Favour,F,Live Entertainment Fine Dining Revenue for the city,45-54,Female,M4M
Favour,Somewhat in Favour,F,It brings money to the province.  McGuinty's gone so there's less of a chance for waste. I'm not strongly in favour because it does have its cons. ,,,
Favour,Strongly in Favour,F,Creates jobs Attracts more people come to Toronto and spend money The city will beefit it from it and use the money for more infrustracture,25-34,Male,M5V
Favour,Strongly in Favour,F,Job opportunities fresh entertainment dinning,35-44,Female,M8V
Favour,Strongly in Favour,F,Economy Job improvement Entertainment,,,
Favour,Strongly in Favour,F,financial benefits for city and province job creation tourist attraction,,,
Favour,Strongly in Favour,F,tourism jobs/econimic growth of Toronto artistic and cultural factors,25-34,Female,M9C
Favour,Strongly in Favour,T,brings revenue to Toronto  ,,,
Favour,Strongly in Favour,F,Economic Development Job Creation Tourist Attraction,25-34,Male,M2J
Favour,Strongly in Favour,F,Economic Growth  ,25-34,Male,M4G
Favour,Strongly in Favour,F,It will create new - ongoing and construction jobs The city needs to reinvent itself with more tourist attractions the City needs the revenue it will generate,55-64,Male,m1j
Favour,Strongly in Favour,F,Bring the city of Toronto up to an international level Great for the economy Bring Great jobs and stability the the city of toronto,35-44,Male,m5k
Favour,Somewhat in Favour,F,"Guaranteed traffic jams, with cars from casino  ",65 or older,Female,m1n
Favour,Strongly in Favour,F,"Bring much needed revenue to the city Provide options for people so they don,t have to drive to Rama or Niagara MGM will provide jobs and other services, along with the casino",55-64,Female,
Favour,Strongly in Favour,F,I like to gamble Brings more money into the city. People stay in hotels People will shop around the casino,45-54,Female,m1r
Favour,Somewhat in Favour,F,Increase in crime and break/enters due to people with gambling problems Depending on location .. increased traffic congestion Attract the wrong kind of people (gamblers) to the City,45-54,Female,M6M
Favour,Strongly in Favour,F,local entertainment love to gamble good for tourism,,,
Favour,Strongly in Favour,F,Outstanding opportunity for the City to have a first-rate casino facility Major Cities in the U.S. have casinos Huge Tourism draw,35-44,Male,M6P
Favour,Strongly in Favour,F,Tourism Jobs ,35-44,Female,
Favour,Strongly in Favour,F,jobs for the city extra money to the city make the city more exciting,55-64,Male,m4m
Favour,Strongly in Favour,F,"Economic Development Job creation and tourism to toronto If it's in a neighbouring city, we still have the cost of gambling problem to deal with but not the revenue and economic benefits of the development",25-34,Male,m5a
Favour,Strongly in Favour,F,I like the idea of an adult place for entertainment The renovations at Woodbine have been a great experience and enhanced my entertainment I've been to Las Vegas and would love to have that entertainment value in Toronto,45-54,Female,L7L
Favour,Strongly in Favour,F,Revenues for the city/province Job creation Increased tourism,35-44,Male,M5V
Favour,Strongly in Favour,F,The revenue to the city of Torotno If it's not built in Toronto it will be nearby therefore we will have the downsides without the positives Exhibition Place is useless 49 months a year,45-54,Male,M6N
Favour,Strongly in Favour,F,Its a pity to have to drive to Niagara or Rama if you want to have a casino day A city like Toronto must have a casino ,,,
Favour,Strongly in Favour,F,every town in the world nowadays has a casino!!!!!!!!!!!!!!!!!!!!!!!  ,65 or older,Male,m9p
Favour,Strongly in Favour,F,Jobs Tourism Entertainment,35-44,Male,M5K
Favour,Strongly in Favour,F,I like casino gambling brings jobs good for tourism,55-64,Female,M9V
Favour,Strongly in Favour,F,Great for city Money for city Great for city,,,
Favour,Strongly in Favour,F,job job job,35-44,Male,m5b
Favour,Strongly in Favour,F,"Toronto needs something BIG again...the Miller era cancelled evrything that was BIG. The mothballed ""Ontario Place would be perfect site...its even already shut down and ready for a rebuild. ",45-54,Male,M5V
Favour,Somewhat in Favour,F,Will create many new jobs Will encourage more people to visit Will encourage myself and family to attend this casino rather than an out-of -town one,55-64,Female,L5N
Favour,Strongly in Favour,F,"If Toronto does not build a casino, it will be built in another GTA municipality - Toronto will lose any potential revenue. A casino complex in downtown Toronto would boulster the existing entertainmenttourist district. Currently people who wish to gamble have to leave the city to do so....to say no is like implementing proabition and we saw how well that worked.",65 or older,Male,M1M
Favour,Strongly in Favour,F,Toronto becomes a world class city Influx of tourism New infrastructure will be built,45-54,Male,M6C
Favour,Strongly in Favour,F,Tax Revenue Infrastructure improvements People already gamble so why not make money from it.,45-54,Male,M5M
Favour,Strongly in Favour,F,"good for the economy ,,good for the status of this city  ",55-64,Male,m4k
Favour,Strongly in Favour,F,tourism  ,,,
Favour,Strongly in Favour,F,tourism entertainment job opportunities,,,
Favour,Strongly in Favour,F,We talk about being a world class city...but it seems Niagara Falls and Orrilia have beaten us to it!!! ONLY Capital City In Canada Without One!!!.......GOOOO REGINA!!!! ,45-54,Male,H6H
Favour,Strongly in Favour,F,"Revenue for the City of Toronto Improved reputation for the city as a ""world class city."" Increased tourism revenue for all of the city's attractions.",45-54,Male,M1M
Favour,Strongly in Favour,F,Provides direct jobs to Torontonians Provides a large amount of tax revenue for City of Toronto programs Will indirectly draw in more investment in the region with increased awareness of Toronto on the global map,Prefer not to disclose,Female,M1E
Favour,Strongly in Favour,F,"Toronto is now on the verge of becoming a world class city; Every major city in the world has a casino. Toronto will receive a large amount of tax dollars from the casino If the casino is opened in an ender-developed ares like the woodbine race track area, where there aren't a lot of businesses, having a casino there will bring other businesses in, such as restaurants, gas stations, hotels, etc, which will bring in even more money for the city.",25-34,Male,m9w
Favour,Somewhat in Favour,F,Revenue Jobs ,35-44,Male,M5B
Favour,Strongly in Favour,F,Increase city income Bring more tourists to Toronto ,55-64,Female,M1N
Favour,Strongly in Favour,F,"10,000 new jobs $200 million revenue crime rate remained low or lowered in the area of exisiting casinos",15-24,Prefer not to disclose,m1m
Favour,Strongly in Favour,F,Increased revenue for the city Job oppurtunies Attracting new tourists to the city,,,
Favour,Strongly in Favour,F,Economy Tourism Entertainment,25-34,Male,M2J
Favour,Strongly in Favour,F,Money Jobs Makes Toronto elite,25-34,Male,L3t
Favour,Strongly in Favour,F,Jobs Renovation of the area Economic profits,55-64,Male,M3M
Favour,Strongly in Favour,F,Economic. It creates lots of jobs. Showcases Toronto as a world destination Tax return for the city,,,
Favour,Strongly in Favour,F,a casino would draw in tourism like Toronto deserves great addition to helping improve the waterfront/skyline great addition to the already established business/conference facilities in Toronto,35-44,Female,L1T
Favour,Strongly in Favour,F,Toronto needs a new tourist attraction (I'm aware of the Aquarium God knows it took long enough to get one here)  ,25-34,Female,M2L
Favour,Strongly in Favour,F,"Tourism and spinoff Economic Benefits Significant Direct employment Improve Toronto's standing as a truly world class city with a full casino, entertainment, Dining and shopping complex",35-44,Male,M3A
Favour,Strongly in Favour,F,"Financial revenue Tourist attraction (landscape, prestige, architecture) Entertainment complex",25-34,Male,M9C
Favour,Strongly in Favour,F,"Resort type casino complex would attract tourists as well as provide residents of GTA a new entertainment venue Bring in revenue for the city, alleviating tax burden that is draining the average residents bank account Add a new element of excitement to our vibrant city",55-64,Female,M1W
Favour,Somewhat in Favour,F,i like casino's not really able to travel far to go it will generate revenue for toronto may bring in more tourists,35-44,Female,m4m
Favour,Strongly in Favour,F,It will create jobs Have a use for the port lands Toronto will be stuck with the problems where ever it is in GTA so we should host and reaps as much as benefit as possible.,45-54,Male,
Favour,Strongly in Favour,F,Tourism Jobs gives the government some money,25-34,Male,M4R
Favour,Strongly in Favour,F,toronto needs a casino because we can keep money in the city we need to bring in more tourists a casino can help with financing transit which we need to stay a first class city,25-34,Female,m1c
Favour,Strongly in Favour,F,Local Employment Tax Dollars for the city Yearly revenue due to additional tourist traffic,,,
Favour,Strongly in Favour,F,Jobs Increased tourism Tax revenue,45-54,Male,M4J
Favour,Strongly in Favour,F,revenue for city jobs ,55-64,Female,M9N
Favour,Strongly in Favour,F,increased activity at live horse races  ,,,
Favour,Strongly in Favour,F,It would be yet another fantastic tourist attraction to draw visitors to our great city. So many needed jobs would be created. It would make a fun night out for residents as well as tourists.,45-54,Male,m5b
Favour,Strongly in Favour,F,jobs for Toronto  ,65 or older,Female,m4k
Favour,Strongly in Favour,F,BRING MORE JOBS TO CITY  ,,,
Favour,Strongly in Favour,F,"Gaming is a reality, people who enjoy gambling will continue to do regardless of a new casino or not. There are many intrinsic dangers that accompany not servicing this segment properly and safely. People are driving down the dangerous 400 to Rama in winter, playing poker in underground unsafe environments.",35-44,Male,M6K
Favour,Strongly in Favour,F,Good jobs Good for other business such as tourism etc Will add to cache of visiting Toronto and Ontario,65 or older,Male,M2R
Favour,Strongly in Favour,F,cause i think the city of toronto needs to have that caind  of recreation. and also brings jobs oportiunity. and brings tourist to  are beautiful country,25-34,Female,M3L
Favour,Strongly in Favour,F,"help to generate jobes, tax money and tourisim world class city can also be used to fund new public transit",55-64,Male,M4C
Favour,Strongly in Favour,F,Increased value in Toronto as a destination. Jobs Redevelopment of an important downtown area with 0 public funds.,35-44,Male,M1C
Favour,Strongly in Favour,F,THIS WOULD MEAN GOOD PAYING JOBS MUCH NEEDED REVENUE FOR THE CITY PLACE FOR ALL TO GO TO,,,
Favour,Strongly in Favour,F,employment tourism ,35-44,Male,L0G
Favour,Somewhat in Favour,F,  ,,,
Favour,Strongly in Favour,F,To keep the jobs for the people currently working at Woodbine  ,45-54,Female,l3y
Favour,Strongly in Favour,F,"Brings new tourists to the city Utilize existing space better, resort complex etc New money for the city",35-44,Male,m4k
Favour,Somewhat in Favour,T,Victims will be middle class and poor citizens. Suck a blood out of them. Who will pay for a physical and mental health?  ,65 or older,Male,M6P
Favour,Somewhat in Favour,F,"Biz/developer/crony interests have too strong a voice in dev'l and will make any benefits modest. No more waterfront condos! It would be a mistake to put it anywhere other than the current Exhibition Place; relocate the Ex to Ont. Place. ALL parking within 1 km should be underground, to heal the landscape's link the site to the water for citizens' rec. uses.",45-54,Male,M6P
Favour,Somewhat in Favour,F,Employment Make use of the CNE Grounds Make use of Ontario Place Grounds ... love the plans from MGM,,,
Favour,Somewhat in Favour,F,money for city services  ,25-34,Female,m1t
Favour,Strongly in Favour,F,It will create some need revenue for the city  ,35-44,Female,L3z
Favour,Strongly in Favour,F,Lots of revenue Lots of jobs Lots of tourism,55-64,Female,M2K
Favour,Strongly in Favour,F,"it takes in more than just gambling sporting events e.g. boxing, IBF,entertainment,singing, dancing, preformers, eg Circ-de-sole it brings job growth to the city and that Will lower crime",65 or older,Male,m5e
Favour,Strongly in Favour,F,Want the theatre venue here that goes with a Casino Keep the money in Toronto instead of people travelling up to Casino Rama or Niagara. Job creation.,45-54,Female,M4Y
Favour,Strongly in Favour,F,A new casino will sustain jobs at Woodbine & generate new ones It will be good for the economy Provide revenue to the city,35-44,Female,M9W
Favour,Strongly in Favour,F,We need more tourist attractions in city Jobs Taxes,55-64,Female,M6p
Favour,Strongly in Favour,F,"Generate Jobs Give reason for people who live in the burbs another reason to come to Toronto Something that is not run by the maffia oh, I mean the government.",45-54,Male,L1N
Favour,Somewhat in Favour,F,Increased tourism in Toronto Employment in Toronto Worried about the addiction people could develop,55-64,Female,
Favour,Strongly in Favour,F,i like casinos we don't have a casino seems like progress,35-44,Male,M6G
Favour,Strongly in Favour,F,The city really needs money The city really needs money It would increase the number of tourists to the city,25-34,Female,M5T
Favour,Somewhat in Favour,F,Location - not in favour of it being downtown  ,,,
Favour,Strongly in Favour,F,Bring in tourists create jobs money for the city,,,
Favour,Strongly in Favour,F,Economic Growth for the City of Toronto New Jobs Improving our waterfront,35-44,Male,M2N
Favour,Strongly in Favour,F,tourist attraction job creation income for the city,55-64,Female,
Favour,Strongly in Favour,F,job creation tourism draw ,,,
Favour,Strongly in Favour,F,"Employment, Revenue  ",65 or older,Female,M9P
Favour,Strongly in Favour,F,"additional income for the city, money can then be used to fix roads and public transit additional jobs makes toronto a better tourist attraction",25-34,Male,m6h
Favour,Strongly in Favour,F,"I beleive it will be very good for this city, for jobs, and revenue coming to the city  ",55-64,Male,
Favour,Somewhat in Favour,F,"A belief in individual freedom. A belief in less government interference in the private sector. A slight concern over the social implications of a casino, as well as adding to an already gridlocked transportation system.",25-34,,M6R
Favour,Strongly in Favour,F,  ,65 or older,Female,m1l
Favour,Strongly in Favour,F,  ,25-34,Female,M8V
Favour,Somewhat in Favour,F,"Economic Development - jobs, tax revenue Increased Tourism ",,,
Favour,Strongly in Favour,F,"Jobs, Tourists, Income for City  ",65 or older,Female,
Favour,Strongly in Favour,F,Adding additional Tourism cache to the city Revenue infusion on multiple levels ,35-44,Female,M4J
Favour,Somewhat in Favour,F,"Increased tax revenue for the city Increased tourism I don't believe that having access to gambling makes people gamblers, stupid argument",25-34,Female,M5A
Favour,Strongly in Favour,F,I think it will increase status of tourism destination Bring jobs much needed especially for the younger ones that are educated and are not able to find jobs Bring necessary money for Toronto to build necessary infastructure and really bring the city into the next century,,,
Favour,Strongly in Favour,F,Bring tourism to Toronto Supplemental funding for the city Great for the waterfront,35-44,Female,M3m
Favour,Strongly in Favour,F,Non tax revenue Entertainment Tourism,25-34,Female,
Favour,Strongly in Favour,F,More entertaiment options Higher attraction for tourists ,35-44,Male,M2J
Favour,Strongly in Favour,F,Job creation Revenue for city Another city attraction for tourist and residents,35-44,Female,M9V
Favour,Strongly in Favour,F,World class = casino is available Toronto desperately needs more to be more fun We need a new tourist attraction,35-44,Female,M9a
Favour,Strongly in Favour,F,need more tourist attractions love to play blackjack great shows and restaruants,45-54,Male,m6m
Favour,Strongly in Favour,F,Makes good business Create new jobs ,35-44,Female,M9P
Favour,Strongly in Favour,F,provide jobs and contrbute. to healthcare great for tourism make Toronto a world class destination,,,
Favour,Strongly in Favour,F,Good for tourism Great job opportunities ,25-34,Female,M6K
Favour,Strongly in Favour,F,more revenue more jobs inprove tourism,55-64,Male,m9r
Favour,Strongly in Favour,F,Great draw for a world class city City revenue to mitigate taxes increase in downtown core jobs regardless of how many,55-64,Female,M4M
Favour,Strongly in Favour,F,revenue to the city and becoming a world class destination  ,,,
Favour,Strongly in Favour,F,WIll bring more tourist to the city Create more jobs and opportunities Will generate more business around the area,25-34,Female,m6j
Favour,Strongly in Favour,F,"Toronto needs the additionl revenue A well done, showpiece casino, similar to Montreal's, would add some pizazz to a dull city. Casino's, especially showpiece casinos, attract tourists for the shows and the atmosphere. We need tourists.",55-64,Male,M4L
Favour,Strongly in Favour,F,I enjoy going out to gamble right now need to travel to far Good for the city Going to have one in GTA may as well reap the benifits from one,45-54,Male,
Favour,Strongly in Favour,F,More Jobs More Toursit More places to go for Toronto residence,,,
Favour,Strongly in Favour,F,  ,,,
Favour,Strongly in Favour,F,Toronto  to maintaine world status will provied employment generate revenue,65 or older,Female,M1E
Favour,Somewhat in Favour,F,"As long as the city gets a large cut for programs such as the ""Dangers of Gambling"", and other community development, infrastructure updates and social programs Creates Jobs Attracts tourism",45-54,Male,M4L
Favour,Strongly in Favour,F,"Will create jobs Will provide tax revenue for the city Can be part of a revitalization of an area and attract new hotels, restaurants and other destinations",25-34,Male,M6B
Favour,Somewhat in Favour,F,"I'm in favour if the casino is a vegas style casino w/ hotel and other ammenities (restaurants, nightlife, shopping, etc.). I suggest it is located where Ontario Place is to have the smallest impact on traffic while being highly accessible. ",25-34,Male,M5V
Favour,Somewhat in Favour,F,  ,35-44,Female,m9n
Favour,Strongly in Favour,F,job opportunities tourism generate revenue,25-34,Female,L8N
Favour,Strongly in Favour,F,More jobs in the city Increased revenue for the city Increase reasons for tourism,55-64,Female,M5J
Favour,Strongly in Favour,F,"Casino participation is voluntary. In the absense of Tolls, vehicle registration tax, local sales tax the City NEEDS revenue Boost 0T0000000000000000000000000000000000000000000000000000000000000000000000000000000000000000000000000000000000000000000000000000000000000000000000000000000000000000000000000000000000000000000000000000000000000000000000000000000000000000000000000000000000000000000000000000000000000000000000000000000000000000000000000000000000000000000000000000000000000000000000000000000000000000000000000000000000000000000000000000000000000000000000000000000000000000000000000000000000000000000000000000000000000000000000000000000000000000000000000000000000000000000000000000000000000000000000000000000000000000000000000000000000000000000000000000000000000000000000000000000000000000000000000000000000000000000000000000000000000000000000000000000000000000000000000000000000000000000000000000000000000000000000000000000000000000000000000000000000000000000000000000000000000000000000000000000000000000000000000000000000000000000000000000000000000000000000000000000000000000000000000000000000000000000000000000000000000000000000000000000000000000000000000000000000000000000000000000000000000000000000000000000000000000000000000000000000000000000000000000000000000000000000000000000000000000000000000000000000000000000000000000000000000000000000000000000000000000000....................................................................................................................................................................................................................................................................................................................................................................................................................................................................................................................00000000000000000000000000000000000000000000000000000000000000000000000000000000000000000000000000000000000000000000",35-44,Male,M6P
Favour,Strongly in Favour,F,create jobs increase tax income ,45-54,Female,M2N
Favour,Strongly in Favour,F,increased tourism increased income for city additional entertainment,35-44,Male,m6h
Favour,Strongly in Favour,F,employment opportunities entertainment & shows new restaurants,55-64,Female,M4K
Favour,Strongly in Favour,F,Revenue for Toronto Increase Visitors to Toronto Set Toronto top City North America,45-54,Male,M9A
Favour,Strongly in Favour,F,  ,,,
Favour,Strongly in Favour,F,More Jobs Revitalize Ontario Place More Taxes for the city,55-64,Male,M5V
Favour,Strongly in Favour,F,"The GTA will have a casino, better the tax and employmnet benefit goes to the city of Toronto The employmnet and hospitality industry would have a major boost We need Toronto to be recognised as a world class city",55-64,Female,M5A
Favour,Strongly in Favour,F,It adds to the entertainment and leisure options in the city Opportunity to raise more money for good causes Opportunity to revitalise underused land or property,35-44,Female,M6P
Favour,Strongly in Favour,F,draw tourists to the city provide jobs entertainment,,,
Favour,Strongly in Favour,F,its about time we get a casino already instead of  driving all the way to niagra  ,,,
Favour,Strongly in Favour,F,Employment opportunities  ,45-54,Male,M8y
Favour,Somewhat in Favour,F,Economic benefits New entertainment options for residents and visitors Appropriate use of Exhibition Place,45-54,Male,M8X
Favour,Strongly in Favour,F,  ,,,
Favour,Strongly in Favour,F,creates jobs billions in toursit dollars I would use for a vacation in winter,,,
