Sentiment,Strength,Conditions,Comment,Age,Gender,Postal Code
Favour,Strongly in Favour,F,Economic Development Jobs Arts and Culture,35-44,Female,M5H
Favour,Strongly in Favour,F,There are allready a number of close by casinos If toronto is not selected then another close by municipality will get one ,55-64,Male,m6s
Favour,Strongly in Favour,F,Toronto needs a casino Avoids having to travel to Niagara & Orillia Provides Top Entertainment & Cuisine,65 or older,Male,M4R
Favour,Strongly in Favour,F,provides more jobs could bring the city more revenue could help make city bigger/stronger,25-34,Male,L6S
Favour,Strongly in Favour,F,"Should help tourism Compulsive gamblers will find a way to gamble, no matter where it is ",45-54,Female,M8V
Favour,Somewhat in Favour,F,economic benefits keep us competitive with other cities that have cansinos ,55-64,Female,M6G
Favour,Strongly in Favour,F,Tourism Financial benefit to city More diversity of activities,35-44,Male,M5J
Favour,Strongly in Favour,F,economic benefits to the city well paying jobs increase in tourism,55-64,Male,m5c
Favour,Strongly in Favour,F,Keep other city run programs open Raise money for the municipality to open community centres and sponsor other iniciatives People are going somewhere else to gamble an spend Toronto money there. Keep our money here,25-34,Male,M4E
Favour,Strongly in Favour,F,Revenue for the city Landmark destination in Toronto job creation,25-34,Female,M5R
Favour,Strongly in Favour,F,"provides economic growth, job opportunities  ",65 or older,Female,M4C
Favour,Strongly in Favour,F,increased employment increased city revenue Making toronto a world class city,55-64,Male,m4k
Favour,Strongly in Favour,F,  ,35-44,Female,m4l
Favour,Strongly in Favour,F,tax money for the city keep the gambling money in the city attract more tourists,65 or older,Male,m4m
Favour,Somewhat in Favour,F,Tourism potential Opportunity to develop brownfields/unattractive/outdated areas of the downtown ,25-34,Male,m4m
Favour,Strongly in Favour,F,"Provides new revenue streams for the City, which it needs; Provides new employment opportunities which it also needs; and Adds a new dimension to what City has to offer to its residents and visitors, who currently go to other parts of the province, country to enjoy, why not have it here and reap the benefits?",45-54,Male,m5v
Favour,Somewhat in Favour,F,"Revenue to the city and job creation Additional entertainment option(s) Enough people head to Niagara or Casino Rama already, would keep more money in the city",35-44,Male,M4L
Favour,Somewhat in Favour,F,Revenue for city jobs waterfront development,35-44,Male,M4J
Favour,Strongly in Favour,F,Government Revenue Increased Tourism Jobs,35-44,Male,M9B
Favour,Somewhat in Favour,F,"Opportunity to repurpose Ontario Place, or potentially add value to CNE grounds Economic impact Potentially positive impact on Toronto brand globally",45-54,Male,m4l
Favour,Strongly in Favour,F,Employment Bring alot more tourist revenue downtoiwn to stay for longer than a quick picture at the CN Tower I am strongly in favor of this coming to downtown Toronto,45-54,Female,M4M
Favour,Strongly in Favour,F,new jobs new entertainment options ,45-54,Male,m4l
Favour,Somewhat in Favour,F,Jobs Tourists Why not,35-44,Female,
Favour,Strongly in Favour,F,employment opportunities the management will pay for most of the complex the facility can be frequented by all who want to be entertained etc.  Much better than condos,45-54,Female,m4m
Favour,Strongly in Favour,F,"Build it in Toronto or it will go to Markham or elsewhere, we need the revenue Added tourism draw Jobs",55-64,Male,M4Y
Favour,Strongly in Favour,F,money for the community  ,35-44,Female,M4M
Favour,Somewhat in Favour,F,  ,55-64,Male,m4g
Favour,Strongly in Favour,F,Good jobs in Toronto Improved entertainment options I believe the fears around the rise in crime related to the casino overblown,,Male,
Favour,Strongly in Favour,F,economic develipment city improvement tourism money,25-34,Male,m4m
Favour,Strongly in Favour,F,Economic benefits to the City of Toronto Makes Toronto an exciting world class city Brings long term high calibre entertainment to Toronto,,,
Favour,Strongly in Favour,F,Jobs Revenue ,Prefer not to disclose,Prefer not to disclose,M4J
Favour,Strongly in Favour,F,"If other cities, including world-class cities, can successfully integrate a casino(s) into their environment, then why can't we? Global competition for tourism - as more cities build casinos, we'll continue to fall behind in developing attractions that attract, and retain, tourists. Diversity - a casino(s) should be seen as one piece only of ongoing development aimed at tourism; Toronto doesn't do enough to attract tourism.",55-64,Male,M4J
Favour,Strongly in Favour,F,decrease the city's debt increase funding for healthcare and education across the province increase tourism to the city,35-44,Female,m5e
Favour,Somewhat in Favour,F,Employment and other economic benefits for the region. Attract tourists. ,65 or older,Male,M4K
Favour,Strongly in Favour,F,Will bring tourism and is fun to do as long as in reason  ,55-64,Female,M1E
Favour,Somewhat in Favour,F,"Tourism attraction equivilant to that of other world class tourist desitnations Spin off industries, like restaurants and live shows. Job creation",35-44,Female,M5V
Favour,Strongly in Favour,F,Job Creation Increase in Tourism to Toronto Drive synergies with already great entertainment in Toronto,35-44,Male,M4J
Favour,Strongly in Favour,F,Good for the local economy--financial benefit Good for the local economy--jobs now and long-term Good for the local economy--build strength around the site and critical mass,45-54,Male,L4A
Favour,Somewhat in Favour,F,Revenue for the city More appeal for tourists Making unused space fun and beautiful,25-34,Female,M4C
Favour,Strongly in Favour,F,  ,Prefer not to disclose,Prefer not to disclose,M3M
Favour,Strongly in Favour,F,"people travel outside of Toronto now to play - lost revenue I am a responsible adult, like to play slots but travelling out of the city means I rarely do there are already charity casinos etc. the city should have it's own",45-54,Female,m4y
Favour,Somewhat in Favour,F,Provide jobs A big city should have a casino for tourism Source of revenue for the city,45-54,Female,M4M
Favour,Strongly in Favour,F,create employment economic benefit to local businesses revitalize downtown Toronto,45-54,Female,M5G
Favour,Strongly in Favour,F,new attraction waterfront development opportunity I would go,35-44,Female,m4m
Favour,Strongly in Favour,F,"casinos and all they entail - entertainment, tourists, conventions, jobs - are all good for Toronto people always have and will gamble, and it's legal in Ontario, so Toronto should benefit rather than elsewhere Toronto is an eclectic mix of cultures, values, interests - casinos are just one more that belong in the mix",65 or older,Male,M4J
Favour,Strongly in Favour,F,Further development of tourist attractions Brings needed tax income Easier access to Ontario Casinos for Toronto residents,25-34,Male,m4j
Favour,Somewhat in Favour,F,new tourist attraction jobs new entertainment option,55-64,Male,
Favour,Strongly in Favour,F,section 37 money for public transportation city of toronto profits for Gardiner repair/replacement/tunnel ,55-64,Male,m5z
Favour,Strongly in Favour,F,"Many people gamble, and do so at Niagara, or Rama. If they gamble instead in Toronto, then Toronto would gain some benefit instead of the profits going to another locale. People worry about bringing casinos to Toronto. We already have slots at Woodbine, Bingo, lotteries, the internet, and off track betting. Banning a full fledged casino is closing the barn door after all the horses have left. More casinos in Southern Ontario increases the competition and that usually works in the favour of the consumer.",65 or older,Male,M2R
Favour,Somewhat in Favour,F,Believe people have the right to choose Have concerns around addiction issues ,45-54,Male,M4A
Favour,Strongly in Favour,F,Economy economy economy,35-44,Female,M5V
Favour,Somewhat in Favour,F,"ICasinos, albeit diststeful, are here. If they don't build it in Toronto, it will be in Pickering or Mississauga. Why should we not get the financial benefit?  ",45-54,Male,m4m
Favour,Strongly in Favour,F,I enjoy going to a casino may bring some tourist dollars to toronto helps toronto become more of a world class city,45-54,Male,m4m
Favour,Strongly in Favour,F,Financial revenues for the city - benefit to many different areas - Toronto needs outside money to succeed in the global Job creation - pre construction and post construction Tourism/visitor benefits - we need a bigger convention centre to accomodate larger conventions which we are unable to host at the moment.,65 or older,Female,M4K
Favour,Strongly in Favour,F,Get some excitment in the city Keep the money in Toronto Reduce traffic to other casinos.,45-54,Male,M4K
Favour,Strongly in Favour,F,It will bring in a LOT of money for the city. Other major cities have had them. It would be a major tourist draw.,55-64,Female,M1C
Favour,Strongly in Favour,F,Jobs Economic developent Green development,35-44,Male,M6S
Favour,Somewhat in Favour,F,city could use the money more tourists money for other small business from tourism,45-54,Female,M4J
Favour,Somewhat in Favour,F,It will generate significant construction and other jobs which is good for the city. It will generate long term tourism income for the city ,25-34,Female,M4M
Favour,Strongly in Favour,F,jobs tourism good for the city,25-34,Male,M4V
Favour,Strongly in Favour,F,"Bring in tourism Bring in revenue for Toronto, in hopes it can be put towards supporting Toronto programs (youth, healthcare, etc) Create jobs",35-44,Female,M4Y
Favour,Somewhat in Favour,F,Generate Money for Govrnment Services  ,45-54,Male,M6R
Favour,Strongly in Favour,F,jobs jobs jobs,45-54,Male,m6k
Favour,Strongly in Favour,F,I fly to vegas for this sort of entertainment I drive to Niagara or Rama for this sort of entertainment Toronto needs this attraction for jobs and revenues,45-54,Male,M1B
Favour,Strongly in Favour,F,tourism increase economic boost potential for further investment,25-34,Female,m4p
Favour,Strongly in Favour,F,  ,55-64,Male,M1C
Favour,Strongly in Favour,F,It will generate money in the city from visitors Negative impacts can be mediated ,45-54,Male,M4k
Favour,Somewhat in Favour,F,"The city could defintely use the extra tax/rental revenue We're a big city, time for us to grow up and let people play however they want. ",55-64,Male,M4K
Favour,Somewhat in Favour,F,Toronto will make  money  to help pay down the deficit  ,45-54,Female,m4j
Favour,Strongly in Favour,F,Income generated for the city Opportunity for brining in tourists to the city Employment opportunities,45-54,Male,M4X
Favour,Strongly in Favour,F,"Tourism would strongly benefit, not just for gamblers The city would make money If done properly, would look great on the skyline and be a great addition to the city.",25-34,Male,
Favour,Strongly in Favour,F,money personal enjoyment tourism,45-54,Male,m6s
Favour,Strongly in Favour,F,Jobs Taxes Fun,45-54,Male,M5A
Favour,Somewhat in Favour,F,"I see people from Toronto travelling to other locations to attend a Casino. If there was one in Toronto, they would spend their money in our city.  ",35-44,Male,
Favour,Strongly in Favour,F,Gambling Employment opportunities Entertainment,15-24,Male,M5M
Favour,Strongly in Favour,F,tourism money jobs,,,
Favour,Strongly in Favour,F,Provides a top-rate entertainment venue with subsidized tickets Keeps more money in Toronto (I currently visit Niagara and Windsor...leaving money there) Creates thousands of new jobs,55-64,Male,M4y
Favour,Strongly in Favour,F,Making this city a world class city bringing in new jobs something for adults to do other then drinking,25-34,Male,M4H
Favour,Somewhat in Favour,F,Attraction of investment and world class developments Additional tourism ,25-34,Male,M5A
Favour,Strongly in Favour,F,Revenue for the city Entertainment ,25-34,Male,m9a
Favour,Strongly in Favour,F,If Toronto does not get a casino we will lose Conventions Tourist & tax dollars  ,55-64,Male,M4L
Favour,Strongly in Favour,F,Creates jobs Good for tourism I would like a casino closer to home,45-54,Female,M2N
Favour,Strongly in Favour,F,I see no reason not to Will bring in Tourism I like to go the the casino once in a while,45-54,Female,m4p
Favour,Strongly in Favour,F,Casinos have been proven to be excellent sources of municipal and provincial income  ,45-54,Female,M5C
Favour,Strongly in Favour,F,Freedom - we should have the right to gamble if we want to.  ,35-44,Male,M4X
Favour,Strongly in Favour,F,"I'm not a heavy gambler, but when I do decide to go, I have to travel to Niagara Falls, Orillia or Woodbine Race Track. I think it will be good for the city. Attract tourists. It will bring in revenue and maybe help pay down the deficit if done right, and help with charities.",55-64,Female,M3K
Favour,Somewhat in Favour,F,"I'd rather have it in Markham where I live than have to go downtown If it can't be in Markham, then Toronto is the next best place A casino locally would be awesome!",35-44,Female,L3R
Favour,Strongly in Favour,F,It will create jobs It will heighten tourism that will benefit our surrounding businesses (example PORTER) There's nothing to do in that area.  It's wasted space.,25-34,Female,L1R
Favour,Strongly in Favour,F,Jobs for the Hospitality and Tourism Industry Economic Stimulus More International exposure of Toronto to the World bringin international tourists,15-24,Male,M9A
Favour,Strongly in Favour,F,"Need to find new revenue streams - a casino will provide much-needed funds. Provides jobs Will put Toronto ""on the map"", so to speak.",45-54,Female,M4J
Favour,Strongly in Favour,F,An outstanding opportunity to have another world class entertainment opportunity for the city. Tax revenue. Tourist attraction with its associated revenue for the city.,65 or older,Male,
Favour,Strongly in Favour,F,"A source of income , employment, land tax revenue, tourist dollars, all the evils associated with casinos are also source of revenue, People should play within their limits, Niagara falls has gambling for children, re winning tickets for playing games",55-64,Male,M4L
Favour,Strongly in Favour,F,jobs tourism if at Exhibition Place there will be money to revitalize Ontario Place,45-54,Female,M8V
Favour,Strongly in Favour,F,World class entertainment Great venue to attract people These casinos (new ones) are really beautiful - just look at Vegas,35-44,Male,P5N
Favour,Strongly in Favour,F,It would be nice to have a casino closer to home It would increase revenue to toronto and this would be good ,55-64,Male,M4K
Favour,Strongly in Favour,F,Cheaper for me than flying to Vegas which I do twice a year. Will make us a real tourist destination. Jobs Jobs jobs,65 or older,Male,M4Y
Favour,Strongly in Favour,F,more attractions in toronto economic benefits city branding,25-34,Male,M2M
Favour,Strongly in Favour,F,"Casinos bring entertainment acts to the city (musicians, comedians) that would not otherwise tour here Closer than Rama or Niagara The city needs more grown up games and entertainment.",35-44,Male,L5V
Favour,Somewhat in Favour,F,"People can gamble on-line anywhere any time anyway, we might as well get some tax revenue I am in favour only of a stand alone casino. ",45-54,Male,M5R
Favour,Strongly in Favour,F,Money for the City  ,55-64,Male,M4W
Favour,Somewhat in Favour,F,"there are people, locals and tourists, would be interested in this entertainment unique opportunity for great enhancements to the area - redevelopment and revitalization --- this is a primary community benefit!!!!! maybe the revenues from the casino can pay for transit expansion",45-54,Female,m6s
Favour,Strongly in Favour,F,More Jobs More Tourists ,55-64,Male,M8Y
Favour,Somewhat in Favour,F,  ,65 or older,Male,m4w
Favour,Strongly in Favour,F,Fun Increased Revenue Jobs,35-44,Male,M4M
Favour,Strongly in Favour,F,Enjoy the slots. Will know my limit. ,65 or older,Female,M6M
Favour,Somewhat in Favour,F,The amazing proposals for the redevolopment of the Toronto Metro Convention Centre put forward by Oxford. The park that would be built along the rail tracks. Two 70-storey office towers (with all the economic benefits to come along with it) to be designed by Sir Norman Foster.,25-34,Male,M4M
Favour,Somewhat in Favour,F,A large portion of my income comes from a related source (horseracing) for which I provide entertainment for patrons It provides considerable employment for the many entertainers I book each year Considerable funding is generated for projects which might otherwise not get such funding,65 or older,Male,M4C
Favour,Strongly in Favour,F,"generation of revenue for the province reduce police resources to monitor gambling dens, less incentive for illegal operations entertainment for a world class city",25-34,Prefer not to disclose,m5a
Favour,Somewhat in Favour,F,"Increased Tax Revenue (for Province, and I assume some royalties to Toronto). Casino will be located in GTA no matter what and Toronto will still have and negative consequences without the revenue. Will draw additional tourists - help hospitality industry.",55-64,Male,M2K
Favour,Strongly in Favour,F,"Global world cities have casino(s) in their urban core.  London, Paris, Singapore, Madrid, Barcelona... This is simply an addition to the rich tapestry of offerings Toronto has as a city. Addiction statistics are wildly overestimated and a casino in Toronto (or Markham if we reject) will not help.",15-24,Male,m8v
Favour,Strongly in Favour,F,I like to play slot machines More choice of places to play We need a draw for Toronto and I believe a resort casino would do that.,55-64,Female,L9T
Favour,Somewhat in Favour,F,A well managed casino property could be positive for Toronto Investment in the city Jobs,45-54,Male,M4k
Favour,Somewhat in Favour,F,Toronto needs the revenue not sure Casino best way to get the revenue Other cities/communities seem to do OK with a Casino located in their area,45-54,Male,M4K
Favour,Somewhat in Favour,F,revenue for the city  ,55-64,Male,M4K
Favour,Strongly in Favour,F,"Other citys have casino's (windsor, Niagara falls) and they are doing fine  ",55-64,Male,M4M
Favour,Strongly in Favour,F,"This is a city of culture, gambling is not something that is alien to the western world, why don't we have a casino here? I don't think that the inevitable negative effects will be more pronounced with a casino in the city as opposed to in niagara. It will inevitably attract business and bring revenue to the city that could be properly spent elsewhere.",25-34,Male,M4K
Favour,Strongly in Favour,F,create more jobs more revenue attracting more tourists,45-54,Male,M6H
Favour,Strongly in Favour,F,Destination Venue to compete with other major cities that have Casino and convention centre Creation of more Jobs and another venue to showcase talent additional revenue to city from Casino can be used to futher enhance the city,55-64,Male,M6P
Favour,Strongly in Favour,F,Additional source of adult only entertainment Revenue for the city Local employment,35-44,Male,m4c
Favour,Strongly in Favour,F,It will bring jobs and funds to a cash-strapped city. It will provide fun and entertainment  to residents and make Toronto more competitive for tourism. Better conventions and entertainment too/ Residents have to travel to Niagara Falls Ajax or take close to a 2 hour transit ride to woodbine. We need one downtown. Why not keep the money and jobs here!!!,45-54,Male,M4Y
Favour,Strongly in Favour,F,"Torontonians already gamble but drive or bus outside the city to do so meaning Toronto jobs are lost and the environment damaged by the drive there and back potential development encompassing live, work, play philosophy is huge--including transit economically win win -- but shouldn't be in the downtown core -- totally unnecessary for success",55-64,Female,m1w
Favour,Strongly in Favour,F,"brings revenue  to city attracts tourists who will also spend elsewhere- hotels, restaurants, shopping ",55-64,Female,m2n
Favour,Strongly in Favour,F,Boosts tourism Boosts economy Enjoy casinos but have to travel/hotel elsewhere;  why not invest the money right here?,55-64,Female,M6n
Favour,Strongly in Favour,F,JOBS JOBS JOBS,25-34,Male,M1K
Favour,Strongly in Favour,F,Entertainment Jobs World class attraction,,,
Favour,Strongly in Favour,F,Will add to the draw and allure to the City Will generate funds for the City which we need Will provide good paying jobs for Torontoians.,35-44,,M4S
Favour,Strongly in Favour,F,high end entertainment complex jobs revenue for city,,,
Favour,Strongly in Favour,F,job/economic growth more revenue to city of Toronto tourism,55-64,Male,m1p
Favour,Strongly in Favour,F,I think Toronto could benefit from the revenue I think it would help tourism by giving visitors a entertaining time in Toronto It would expand Toronto's entertainment district,25-34,Male,M5S
Favour,Strongly in Favour,F,Would like a place to play poker and blackjack Brings tourists to city ,25-34,Male,m5r
Favour,Strongly in Favour,F,Jobs It's not a CONDO. Incentive to business to show we do mean business and want to be world class.,25-34,Male,M4K
Favour,Strongly in Favour,F,Entertainment Revenue for city ,,,
Favour,Strongly in Favour,F,It will create jobs- especially for students and those under 30's beginning a family in Toronto It will create jobs- increasing  the number of tourists to Toronto from outside Canada - ,65 or older,Male,M5A
Favour,Strongly in Favour,F,  ,25-34,Female,M4n
Favour,Strongly in Favour,F,I want Toronto to have access to the millions and millions of dollars that gambling could bring to the city ( many jobs too) It would be a great chance to redevelop Exhibition place - a wasteland right now I would love to see world class events and entertainment that a casino could bring in.,55-64,Male,M9A
Favour,Somewhat in Favour,F,promote and attract foreign tourist upscale dinning location ,25-34,Male,M1V
Favour,Strongly in Favour,F,It will create jobs It will help with tourism & provide another venue for conventions Personal entertainment,,,
Favour,Strongly in Favour,F,Great revenues to support city activities Build new infrastructures including funding new transportation to get around city. Become a world class city.,55-64,Male,M3J
Favour,Strongly in Favour,F,cannot find a reason why not to have a casino in the city  ,35-44,Male,M1L
Favour,Somewhat in Favour,F,I feel a casino fits into a modern city as ours. It will give us a more internationally known city. Will bring more tourists.,65 or older,Male,m4t
Favour,Strongly in Favour,F,Revenue for city Tourism Economic development,65 or older,Male,M4v
Favour,Strongly in Favour,F,Tourism Entertainment Architecture/revival,25-34,Male,M4j
Favour,Somewhat in Favour,F,A casino would provide jobs A casino would provide revenue for the city ,65 or older,Female,M4J
Favour,Strongly in Favour,F,"I am a resident of Toronto and a gambler and the other casinos are at least an hour outside the city, if not out of the country. I am also a restaurant owner and think a casino in the city would increase tourism to the city and possibly to my business. I think it could help decrease Toronto's debt",25-34,Male,m4k
Favour,Somewhat in Favour,F,"Montreal and Windsor have one and their world did not end (no increase in social problems, etc). increased tourism increased revenue for city coffers",45-54,Male,M4S
Favour,Strongly in Favour,F,increasing job opportunities increasing economic in Torono improving surroundings,Prefer not to disclose,Prefer not to disclose,M6H
Favour,Strongly in Favour,F,  ,25-34,Male,
Favour,Strongly in Favour,F,increase revenue for the city Help sell conventions in the City People like MGM and Cessar Palace will fund a hugh complex that would be world class,65 or older,Male,M9B
Favour,Strongly in Favour,F,All big cities in the world have casinos except Toronto  ,45-54,Male,
Favour,Strongly in Favour,T,"pay too many taxes already, this will help take burdon off overtaxed hardworking people and small businesses  ",55-64,Female,
Favour,Strongly in Favour,F,Detrimental effects not documented nor statistically supportable Toronto needs the money Toronto needs casino to attract more conventions and tourists,65 or older,,
Favour,Strongly in Favour,F,jobs tourism economic growth,,,
Favour,Strongly in Favour,F,income job opportunities tourism,45-54,Female,M1T
Favour,Strongly in Favour,F,Subways Subways Subways,25-34,Male,
Favour,Strongly in Favour,F,Jobs Tourism Access,55-64,Female,M4k
Favour,Strongly in Favour,F,"If it is not built in Toronto, it will be built in the GTA - we should benefit from the revenues.  If it gets built elsewhere in the GTA, we will receive no revenues and will still suffer from the costs associated with gambling Benefits outweigh costs Las Vegas firm could be made to help pay for badly needed infrastructre",25-34,Male,M4M
Favour,Strongly in Favour,F,Economic benefits Jobs Good for tourims,65 or older,Male,
Favour,Strongly in Favour,F,It's good for the economy!  ,65 or older,Male,M2R
Favour,Strongly in Favour,F,"Economic benefit, namely indirect (i.e. increased tourism). Social issues will effect Toronto residents no matter where the Casino is located in the GTA. ",25-34,Male,M4P
Favour,Strongly in Favour,F,Entertainment Global city Revitalize Toronto Convention Centre,,,
Favour,Somewhat in Favour,F,"Retaining revenues for the city. May improve our attraction as a convention city A Casino is coming in the area anyway, Toronto should profit if it can -",65 or older,Male,M4K
