Sentiment,Strength,Conditions,Comment,Age,Gender,Postal CodeFavour,Strongly in Favour,F,The casino is the draw to a multi service complex including a hotel / resort which yields creating hundreds of jobs New restaurants and services that also require new jobs. Suppliers of food and services generating revenue for the city,,,
Favour,Somewhat in Favour,F,I visit the casino at Rama and having one closer to home is appealling so I do not have to travel far. Revenue for the City is needed and this would be an excellect source for it The CNE needs to be revitalised along with Ontario Place. This would be  the best location for the casino.,,,
Favour,Strongly in Favour,F,  ,,,
Favour,Strongly in Favour,F,  ,,,
Favour,Strongly in Favour,F,  ,,,
Favour,Strongly in Favour,F,  ,,,
Favour,Strongly in Favour,F,  ,,,
Favour,Strongly in Favour,F,  ,,,
Favour,Strongly in Favour,F,Positive impact on Toronto's local economy and employment Revitalization of areas in need of renewal (including new infrastructure and transportation building in  the area(s) around the new project) Additional needed financial/revenues and increased tourist attraction (will benefit hospitality/hotel/restaurant industries),35-44,Male,M1N
Favour,Strongly in Favour,F,Increased revenue for the city of Toronto. Additional jobs and revenue for supporting industries in Toronto Transportation infrastructure already in place to support this casino.,35-44,Male,M9C
Favour,Strongly in Favour,F,In come for the city Will get the city out of debt Crest jobs,,,
Favour,Strongly in Favour,F,Fun  Money,,,
Favour,Strongly in Favour,F,Entertainment value Economic benefits Tourism benefits,25-34,Male,M3C
Favour,Somewhat in Favour,F,"I don't find a Casino to be an invaluable aspect of the Canadian cosmopolitian landscape I recognize that various interests do want to see a Casino in Toronto, and for that I'd be in favour provided the location is ideal ",,,
Favour,Strongly in Favour,F,Why not cash in from those who wish to indulge?  ,,,
Favour,Strongly in Favour,F,"I have worked for 25 yrs in the Gaming industry, see the excitment, vistors from all over the world who  enjoy our facility I feel Zone 2 would be an asset as it can provide more parking etc Job creation for our community",55-64,Female,M9W
Favour,Strongly in Favour,F,Bring Income to Toronto Create Jobs Provide entertainment for current Toronto residents as well as bring tourists,25-34,Male,l4l
Favour,Strongly in Favour,F,money it will bring more tourism money,25-34,Female,m6j
Favour,Somewhat in Favour,F,Source of revenue for the city.  ,,,
Favour,Strongly in Favour,F,  ,,,
Favour,Strongly in Favour,F,Tourism Revenue World Class City,15-24,Male,L4L
Favour,Strongly in Favour,F,"it takes advantage of societies"" losers, like the LCBO and Ontario Lotteries, why should Toronto lose out?  ",Prefer not to disclose,Male,m4s
Favour,Strongly in Favour,F,"The Casino will bring jobs, both for constuction and long term, to the city The Casino will generate significant revenue for the city The revenue generated can contribute to social and infrastructure programs to better our city",35-44,Male,M4J
Favour,Strongly in Favour,F,"Creates entertainment, excitement & fun! Creates Jobs - Construction, food servers, bartenders, Slot Machine Repair Personnel, ext. Which is needed right now! Creates tourism!, well as least if its built on the waterfront, with a nice hotel and restaurant. It Better be easy to get to from the subway!",25-34,Male,m4k
Favour,Strongly in Favour,F,Will bring more jobs to the City of Toronto Will help the economy develop further with more businesses and hotels around the casino Will help build Toronto a tourist spot for all sorts of people,25-34,Male,M1B
Favour,Strongly in Favour,F,  ,25-34,Male,M1g
Favour,Strongly in Favour,F,Good for Tourism Create New Jobs Keep Toronto residents dollars here versus them gambling in N. Falls or Casino Rama,35-44,Male,M2R
Favour,Strongly in Favour,F,It will create many jobs in the Toronto area and increase tourism.  ,35-44,Male,M1R
Favour,Strongly in Favour,T,FUN City Revenue Tourism attraction,25-34,Female,
Favour,Somewhat in Favour,F,  ,,,
Favour,Strongly in Favour,F,Money would stay in Toronto and spent on what we need and NOT bused to Niagara or Orillia Toronto want to be a WORLD class city - time we atarted to act like one. Large potential for increased tourism.,65 or older,Male,M1B
Favour,Strongly in Favour,F,More Jobs Higher number of tourists Entertainment,35-44,Female,
Favour,Strongly in Favour,F,tourism economic growth and development + revenue for city jobs,35-44,Male,m6r
Favour,Strongly in Favour,F,Will bring much-needed money to the City Will help drive tourism Will bring bigger stars to Toronto for concerts (rather than Casino Niagara or Rama),15-24,Male,M2L
Favour,Strongly in Favour,F,Increase tourism Decrease deficit / boost to local economy I would like one more conveniently located within GTA to visit,35-44,Male,M1M
Favour,Somewhat in Favour,F,"It will promote better infrastructure especially under transportation. It will mean more investment in the downtown core, which is exciting. It is a great entertainment for the late people, which will mean more industry at nighttime, which I think Toronto lacks.",15-24,Male,l1v
Favour,Strongly in Favour,F,People will gamble no matter what. casino will create jobs we need here and not in Vegas  ,45-54,Male,M8V
Favour,Strongly in Favour,F,"this is a form of entertainment. I have to drive over an hour to have fun, thats bad for the environment Toronto is always labelling itself ""a world class city ' and no casino ? gambling is everywhere and some is purveyed by organized crime . Lets help to limit their revenue streams .",35-44,Male,m4j
Favour,Strongly in Favour,F,"I think it will be an excellent income for the city, why give all that money to an other city when we need it so desperatly.  ",65 or older,Female,M1E
Favour,Strongly in Favour,F,increase tourism something fun to do in the city new revenue stream for the city,35-44,Male,M4J
Favour,Strongly in Favour,F,Direct & in-direct job opportunities Increased local investment Better infastructure because it will force new infastructure projects to support casinos,55-64,Male,m5j
Favour,Strongly in Favour,F,Economic stimulus Allows Toronto residents to gamble in Toronto rather than having to go out of town ,45-54,Male,M5p
Favour,Strongly in Favour,F,REVENUE FOR THE CITY AND CREATE JOBS SHOULD HAD CASINO YEARS AGO ,45-54,Male,M3A
Favour,Somewhat in Favour,F,  ,65 or older,Male,M2R
Favour,Somewhat in Favour,F,Take the taxiation pressure away from the public.  ,45-54,Male,M4K
Favour,Strongly in Favour,F,Good source of income for the city and probably consistent Gambling is happening here anyway.  Buses near my house taking people to Fallsview etc. ,45-54,Male,M4M
Favour,Somewhat in Favour,F,Financial: With the Casino in the GTA there will be less revenue outflows to other areas. Social: Creation and keeping of jobs in the GTA. Downside: Problem gambling and the associated issues plus addtional traffic congestion.,,,
Favour,Somewhat in Favour,F,Provides employment opportunities for many within and outside the casino Creates opportunities for ancilliary businesses in the neighbourhood Provides another tourist attraction in the downtown core,65 or older,Male,M9A
Favour,Strongly in Favour,F,"employment financial gain for City no need to increase taxes, good replacement for the reality tax on new homes",45-54,Male,M4Y
Favour,Somewhat in Favour,F,"I understand that it might be an attraction for many people, including the nearby convention-goers, but I would likely never visit it, myself. I want to see the related development, especially the park that is to be superimposed above the rail line. ",45-54,Male,M4Y
Favour,Strongly in Favour,F,"Tourists Influx of millions of dollars to the city to spend on ttc expansion, roads Jobs",45-54,Male,M4C
Favour,Somewhat in Favour,F,  ,35-44,Male,M4Y
Favour,Somewhat in Favour,F,Boosts tourism Boosts revenue Works fine in other cities (Calgary for example as about 6 casinos within the city),25-34,Male,M6R
Favour,Strongly in Favour,F,Revenue for the city.  ,45-54,Male,M9W
Favour,Somewhat in Favour,F,Good for tourism a major moneymaker especially if on city property ,55-64,Male,M4K
Favour,Strongly in Favour,F,"a cosino would be a new destination within Toronto for residents and visitors shops, shows and restaurants that would be part od a casino would be a welcome addition for downtown residents a casino will provide new revinue to the city and jobs",,,
Favour,Somewhat in Favour,F,My support of a casino in the Toronto area depends solely on where it is located.  ,45-54,Female,M9B
Favour,Somewhat in Favour,F,"I believe that a casino would help provide revenue and jobs. However, I am worried about the social impacts (e.g. gambling problems) The building of a casino would help make Toronto more of an entertainment destination",15-24,Female,M9W
Favour,Strongly in Favour,F,We need more attractions for tourists. The City needs to evolve. The City needs to generate more income from other sources other than the taxpayers.,55-64,Female,
Favour,Somewhat in Favour,F,on a personal level do not approve of gambling. do buy lottery tickets. if it can generate income for the city- i say go for it. ,65 or older,Male,m6r
Favour,Strongly in Favour,F,currently traveling to casinos 3or4x month Toronto casino would reduce  travel time  ,45-54,Male,m8v
Favour,Strongly in Favour,F,create jobs increase tourism increase revenue for the city to inject into more social progarms and affordable housing,35-44,Female,M1r
Favour,Strongly in Favour,F,  ,35-44,Male,M3C
Favour,Somewhat in Favour,F,New development New Jobs New economic activity -- new tax revenues for the city,45-54,Male,M4L
Favour,Strongly in Favour,F,Generates income for Toronto Attracts conventions/tourism Will attract new business to Toronto,55-64,Female,M3A
Favour,Strongly in Favour,F,more tourism dollars time for Toronto to have its own casino more employment opportunities,65 or older,Female,M2J
Favour,Strongly in Favour,F,"People do come to cities for a variety of reasons and one of them is gambling. It will attract tourism and allow another alternative for the tourists and businesspeople who are already coming. It will provide a significant revenue stream to Toronto, rather than constantly demanding the residents pay for everything. There will be one either within Toronto or just outside - Markham, Mississauga or Pickering, so one will be coming it just makes sense that we get the revenue, otherwise it will be another dumb decision by those that have not thought this through.",Prefer not to disclose,Prefer not to disclose,M1E
Favour,Strongly in Favour,F,It will bring more tourists People would not have to drive to Niagara just for a casino Will bring many job opportunities.,35-44,Male,M1B
Favour,Strongly in Favour,F,"Adds to jobs, economy and pizzaz for TO Hopefully improves the dull waterfront area ",45-54,Male,
Favour,Strongly in Favour,F,"bring people to the city instead of drivig to Rama or Niagara Increase city revenue Other major Canadian citys have them, we should to.",35-44,Female,m4n
Favour,Strongly in Favour,F,Gaming is fun and sociable. a local casino would help alot of people save time and money travelling to Niagara or Rama It would create lots of new jobs and bring a lot of tourism to Toronto,25-34,Male,l3x
Favour,Somewhat in Favour,F,"Jobs, tourism, concerts. Might visit to gamble. (Might not). ",55-64,,
Favour,Strongly in Favour,F,Creates jobs adds draw to toronto for tourism tax dollars for toronto,,,
Favour,Somewhat in Favour,F,Think the construction would help the economy.  ,65 or older,Male,M5C
Favour,Strongly in Favour,F,i believe it will be a great revenue source for the city will attract tourists as well ,45-54,Female,M4R
Favour,Strongly in Favour,F,Creates jobs adds draw to toronto for tourism tax dollars for toronto,55-64,Female,M8Y
Favour,Strongly in Favour,F,"Enjoy gambling, playing slots, blackjack. A fun source of entertainment Great with a group of friends",45-54,Female,M4K
Favour,Strongly in Favour,F,"the city is old and it needs a new infrustructure,new attractions for tourist and torontonians as well. look at downtown toronto right now left and right and every corner is condo everywhere you go in the downtown core is condominiums or under construction for condo. when do we stop building condo and start creating  employment for our people toronto is a great city and it needs a lot of money to operate each yr and building condominiums in every square ft of the city is just dosent help it makes our city too congested but adding casino and other bussinesis your not just covering all or most of the city cost to operate you creat an employment opportunities for all torontoians as well we need to build a new attractions now..front st west is a perfect spot because you have the CN Tower the Rogers center you can integret them together and make it a huges bussines and tourist attractions. probably the best..so to all of the councilors when you vote think of us and think of our kids future too.",35-44,Male,m6e
Favour,Strongly in Favour,F,people will stay in Toronto rather than going out of town to gamble source of tax revenue source of employment for people in Toronto,65 or older,Female,M4P
Favour,Strongly in Favour,F,World class entertainment Needed revenue Employment gains,35-44,Male,M5C
Favour,Strongly in Favour,F,"For a tourist perspective, Toronto is the only ""world-class"" city in Canada without a local casino. Level playing field for society's ""sin"" businesses - alcohol, strip clubs and smoking. What makes gambling so different from these other businesses? Incremental revenues that rightfully belongs to the City of Toronto from tourists and local gamblers that's currently being lost to Niagara Falls and other areas.",35-44,Male,M5C
Favour,Strongly in Favour,F,i would like an local choice to go to casino when i do it will be great for the economy of toronto it will give tourist another great venue for their entertainment,35-44,Male,M9R
Favour,Strongly in Favour,F,It'll be good for tourism It'll inject much needed revenue into the city ,55-64,Male,m4y
Favour,Strongly in Favour,F,"brings money into the city will help build better transit toronto has too many theatre's and arts, needs something new",25-34,Male,m1k
Favour,Strongly in Favour,F,EXIBITION and Ontario Place needs to be revitized and a casino would be a great anchor. Don't put this casino at the convention centre to much traffic.  ,45-54,Female,M6J
Favour,Strongly in Favour,F,bring money to the city  ,35-44,Female,M2R
Favour,Somewhat in Favour,F,revenue for city jobs ,45-54,Female,m1r
Favour,Strongly in Favour,F,increased revenue for the city taxing an activity that happens anyway ,,,
Favour,Strongly in Favour,F,The city NEEDS the REVENUE Jobs that will be created It will reduce the burden on OVER TAXED property owners like myself,45-54,Male,M4K
Favour,Strongly in Favour,F,Increased city revenue City infastructure Source of city entertainment,15-24,Male,l4l
Favour,Strongly in Favour,F,Jobs Making Toronto a tourist hot spot I like poker,25-34,Male,M9B
Favour,Strongly in Favour,F,Economic benefits to the city from construction Economic benefits to the city from casino use Economic benefits to the city from visitors,55-64,Male,M4P
Favour,Strongly in Favour,F,Toronto is a world class city and should have world class entertainment. I think this will be a positive for the city and bring in a lot of tax revenue.  ,35-44,Male,M5v
Favour,Strongly in Favour,F,Revenue Tourism Urban Vitality and Uniqueness,55-64,Male,M9N
Favour,Strongly in Favour,F,Further entertainment options. Economic boost. Treating citizens as adults who can make their own choices.,45-54,Male,M1n
Favour,Strongly in Favour,F,will bring in $ to city.  can be used for TTC and healthcare.  ,,,
Favour,Strongly in Favour,F,will bring in $ to city.  can be used for TTC and healthcare. will create jobs good for tourism,45-54,Female,M4R
Favour,Strongly in Favour,F,creation of Jobs  ,65 or older,Female,m1n
Favour,Strongly in Favour,F,provide employment tourist attraction entertainment,65 or older,Female,M4V
Favour,Strongly in Favour,F,I think it will create new jobs Toronto is trying to be a world class city and this would be another venue or tourist destination to add to the appeal of Toronto ,45-54,Male,M4V
Favour,Strongly in Favour,F,Economic Development Jobs Tourism,25-34,Male,M5V
Favour,Strongly in Favour,F,Job creation more tax returns to city ,45-54,Male,m1v
Favour,Strongly in Favour,F,Great source of revenue Creates new jobs Increases city exposure,35-44,Male,M5M
Favour,Strongly in Favour,F,Tourism Employment New image of Toronto i.e its transformation into a true world class city,15-24,Male,M5V
Favour,Strongly in Favour,F,Enjoy gambling Niagara and Rama are too far Fun place to go with friends,,,
Favour,Strongly in Favour,F,revenue generation for city infa structure  ,55-64,Male,M8X
Favour,Strongly in Favour,F,"Toronto needs new sources of income that do not involve tax increases. Reduce or eliminate taxes, such as: Land Transfer and Property. I am a retired person on a fixed income,tax and fee increases are a concern.",55-64,Male,M2R
Favour,Strongly in Favour,T,Job creation Tourism stronger economy in city Entertainment,25-34,Male,M5a
Favour,Strongly in Favour,F,Brings more people to toronto creates more jobs makes toronto more of a major player in the world scene,55-64,Female,M4M
Favour,Strongly in Favour,F,generate tourism tax dollars for the city spur development in new areas of the city,45-54,Male,M4Y
Favour,Somewhat in Favour,F,Great for downtown life Good for economy We're a big city - let's not shy away from big city things,25-34,Male,M5V
Favour,Strongly in Favour,F,I would like to go Tourism for the city My extended family would visit more often,45-54,Female,M2r
Favour,Strongly in Favour,F,"Potential for direct revenue from casino- ie: taxes, wealth sharing Potential for indirect revenue- tourism, hotel guests ",,,
Favour,Strongly in Favour,F,potential for direct revenue from casino potential for indirect revenue ,,,
Favour,Strongly in Favour,F,"Economy reason, it will increase new jobs, increase Toronto income and increase tourism revenue  ",35-44,Male,l6h
Favour,Strongly in Favour,F,Direct revenue to be gleaned from casino indirect revenue ,,,
Favour,Strongly in Favour,F,  ,,,
Favour,Strongly in Favour,F,  ,,,
Favour,Strongly in Favour,F,More Jobs More Revenue for city Overall Improvement for the economy as more people from outside Toronto will be spending in Toronto,35-44,Male,M1W
Favour,Strongly in Favour,F,Revenue Entertainment Deserving City,65 or older,Male,M1E
Favour,Somewhat in Favour,F,Jobs Tourism ,35-44,Male,m9v
Favour,Strongly in Favour,F,don't need to drive to Casino Rama increased tax revenue ,25-34,Male,
Favour,Strongly in Favour,F,Create employment opportunity Help the budget ,45-54,Male,m2j
Favour,Strongly in Favour,F,"Funds that could be put towards city priorities (ie. TTC, whatever we're going to do with the Gardiner) Increased employment opportunities Increased tourism",25-34,Male,M5A
Favour,Strongly in Favour,F,Generate money for the city Generate tourism Easy access to gambling,,,
Favour,Strongly in Favour,F,"I gamble already, and it's more convenient for me to spend my money in my city Since they're not betting, I bet online with Europeon websites, that's my money going to another continent Benefit to everyone, gamblers, lots of jobs, entertaining, dining",25-34,Male,M1p
Favour,Strongly in Favour,F,Economic Benefit New attraction for the city further enhance the city scape,25-34,Male,M4P
Favour,Somewhat in Favour,F,It beats driving to Casino Niagra Tax revenue Spruce up a boring part of town,25-34,Male,m1n
Favour,Strongly in Favour,F,it stops going cash out of our province  ,35-44,Male,m3j
Favour,Strongly in Favour,F,tourism status of a real international destination world class entertainment,25-34,Male,m2r
Favour,Strongly in Favour,F,Economy boost Have fun! Create jobs,,,
Favour,Strongly in Favour,F,city needs cash bad great tourist attraction more options in the city/ more jobs,25-34,Male,m4j
Favour,Strongly in Favour,F,"Toronto has the potential to be a world-class city and needs the high profile, progressive approach that a large casino/entertainment complex would bring. Fiscally, it would mean dramatically increased revenues for Toronto/Ontario in terms of taxes. Potentially, with the right planning, marketing and delivery could attract more businesses to the GTA",45-54,Female,M8V
Favour,Somewhat in Favour,F,Generate revenue Employment opportunities Potential location issues cause some hesitation,25-34,Male,M9A
Favour,Strongly in Favour,F,income prestige gambling,35-44,Male,M2N
Favour,Strongly in Favour,F,"A Toronto casino will provide construction jobs and employment for many employees when it is operating. A casino will be a boost to tourism and to the resulting boost in the economy. Revenues from the casino can be used to fund many Toronto projects - e.g. road, subway construction, etc",65 or older,Male,M1T
Favour,Strongly in Favour,F,tourism entertainment value opportunity,25-34,Male,
Favour,Somewhat in Favour,F,Any new development is good for Toronto  ,35-44,Male,M5J
Favour,Somewhat in Favour,F,Increased revenue (tax) to the city. Added tourism - increased revenue for the small business owner/hotels/restaurants. ,35-44,Male,M4J
Favour,Strongly in Favour,F,  ,,,
Favour,Somewhat in Favour,F,revenue for the city another attraction for the city ,55-64,Female,m7n
Favour,Strongly in Favour,F,Revenue for the city Entertainment and tourism option ,25-34,Male,M4Y
Favour,Strongly in Favour,F,  ,55-64,Transgendered,m1x
Favour,Strongly in Favour,F,Revenue for the city Tourism Keeping up with the times,55-64,Female,M4M
Favour,Somewhat in Favour,F,Provide a destination for tourists interested in casino culture Good for economy of the city. ,65 or older,Female,m5v
Favour,Strongly in Favour,F,Jobs Tourism Business/Opportunities,35-44,Male,M1W
Favour,Strongly in Favour,F,Increased Tax revenue for the city to pay for badly needed infrastructure since decreasing industry in City moving to suburbs. Makes Toronto a world class destination city Alternative use of lake shore land than condos,55-64,Female,m6c
Favour,Strongly in Favour,F,"it will increase well paying jobs in Toronto (not just retail jobs) which one can argue will improve overall health (vs being unemplyoed) increased revenue for the City of Toronto (not Markham, Vaughan, Mississauga etc ...) people need a reason to stay in Toronto. Toronto is not a booming city!",25-34,Female,M3L
Favour,Somewhat in Favour,F,Location Location Location,25-34,Male,m4e
Favour,Somewhat in Favour,F,Potential new revenue channel Increase in tourism (if promoted correctly) ,55-64,Male,M4M
Favour,Strongly in Favour,F,"Revenue for Toronto Creates jobs Previously worked in large sporting venues (Rogers Centre, Ricoh Col.) Tourists always asked where the closest casino was. Disappointed when hearing Niagara, Blue Heron or Woodbine Race Track.",25-34,Female,
Favour,Strongly in Favour,F,It's great fun.  ,45-54,Male,M4G
Favour,Somewhat in Favour,F,"I think the increased Revenue is good for the city, namely to improve transit and road infrastructure.  ",25-34,Male,M6K
Favour,Somewhat in Favour,F,increase tourism increase infrastructure ,35-44,Male,
Favour,Somewhat in Favour,F,"New tourist attraction for Toronto Increase employment (not just casino, but a full entertainment complex with Hotel) Can revitalize the Exhibition Ground (where I would like to see the complex)",25-34,Male,m1t
Favour,Somewhat in Favour,F,it could provide jobs and money for the city  ,45-54,Male,M4M
Favour,Strongly in Favour,F,Jobs Tax Revenue No New or increased taxes,45-54,Male,M9C
Favour,Strongly in Favour,F,economic growth tourism city image,35-44,Male,m4r
Favour,Strongly in Favour,F,good for economy  ,45-54,Male,m9a
Favour,Strongly in Favour,F,  ,45-54,Male,M4M
Favour,Somewhat in Favour,F,  ,25-34,Female,M4M
Favour,Strongly in Favour,F,"Direct Municipal Revenue Generation Indirect Economic Benefit (employment, tourism, etc) ",35-44,Male,M4E
Favour,Strongly in Favour,F,to more employment for people in toronto to increase toursium ,,,
Favour,Strongly in Favour,F,"would like to help the City's economy some other way other than raising taxes would like to see the addition of new subways, etc. with help from casino revenues would like to have my money help Toronto, otherwise, it will continue to help the City of Niagara at their casinos",55-64,Female,M1L
Favour,Somewhat in Favour,F,Many of my neighbours take the bus to Orillia once a week.  The money would stay here Not having a casino here will not stop people from gambling Casinos do not make people addicts,45-54,Female,m6p
Favour,Strongly in Favour,F,CITY REVENUE TOURISM ENTERTAINMENT,25-34,Male,M5V
Favour,Strongly in Favour,F,"Judging by the number of Toronto residents who travel outside of the city every day to visit a casino (Niagara, Rama etc.), I believe there is a market for one here. I am in favour of brining in additional revenue to the city to support city services. I support a casino in a community that wants one. This is the only acceptable way to bring one into Toronto.",35-44,Female,M4L
Favour,Strongly in Favour,F,need of extra tax money  ,65 or older,Male,M1E
Favour,Strongly in Favour,F,JOBS CITY REVENUE SOURCE TOURIST ATTRACTION,35-44,Male,M1H
